title,authors,conference_name,conference_year,link
Fine-tuning Language Models over Slow Networks using Activation Quantization with Guarantees.,"Jue Wang, Binhang Yuan, Luka Rimanic, Yongjun He, Tri Dao, Beidi Chen, Christopher Ré, Ce Zhang","36th NeurIPS 2022: New Orleans, LA, USA",2022,http://papers.nips.cc/paper_files/paper/2022/hash/7a43b8eb92cd5f652b78eeee3fb6f910-Abstract-Conference.html
Pareto Set Learning for Expensive Multi-Objective Optimization.,"Xi Lin, Zhiyuan Yang, Xiaoyuan Zhang, Qingfu Zhang","36th NeurIPS 2022: New Orleans, LA, USA",2022,http://papers.nips.cc/paper_files/paper/2022/hash/7a583691ccfcf8945ab714b677ccbf0b-Abstract-Conference.html
Non-monotonic Resource Utilization in the Bandits with Knapsacks Problem.,"Raunak Kumar, Robert Kleinberg","36th NeurIPS 2022: New Orleans, LA, USA",2022,http://papers.nips.cc/paper_files/paper/2022/hash/7a62d9a4c03377d1175b8859b4cc16d4-Abstract-Conference.html
Efficient identification of informative features in simulation-based inference.,"Jonas Beck, Michael Deistler, Yves Bernaerts, Jakob H. Macke, Philipp Berens","36th NeurIPS 2022: New Orleans, LA, USA",2022,http://papers.nips.cc/paper_files/paper/2022/hash/7a7f6cc5dc2a84fb4edf0feb8e5cfd50-Abstract-Conference.html
Agreement-on-the-line: Predicting the Performance of Neural Networks under Distribution Shift.,"Christina Baek, Yiding Jiang, Aditi Raghunathan, J. Zico Kolter","36th NeurIPS 2022: New Orleans, LA, USA",2022,http://papers.nips.cc/paper_files/paper/2022/hash/7a8d388b7a17df480856dff1cc079b08-Abstract-Conference.html
Large-Scale Differentiable Causal Discovery of Factor Graphs.,"Romain Lopez, Jan-Christian Hütter, Jonathan K. Pritchard, Aviv Regev","36th NeurIPS 2022: New Orleans, LA, USA",2022,http://papers.nips.cc/paper_files/paper/2022/hash/7a8fa1382ea068f3f402b72081df16be-Abstract-Conference.html
Diagnosing failures of fairness transfer across distribution shift in real-world medical settings.,"Jessica Schrouff, Natalie Harris, Sanmi Koyejo, Ibrahim M. Alabdulmohsin, Eva Schnider, Krista Opsahl-Ong, Alexander Brown, Subhrajit Roy, Diana Mincu, Christina Chen, Awa Dieng, Yuan Liu, Vivek Natarajan, Alan Karthikesalingam, Katherine A. Heller, Silvia Chiappa, Alexander D'Amour","36th NeurIPS 2022: New Orleans, LA, USA",2022,http://papers.nips.cc/paper_files/paper/2022/hash/7a969c30dc7e74d4e891c8ffb217cf79-Abstract-Conference.html
Towards Lightweight Black-Box Attack Against Deep Neural Networks.,"Chenghao Sun, Yonggang Zhang, Chaoqun Wan, Qizhou Wang, Ya Li, Tongliang Liu, Bo Han, Xinmei Tian","36th NeurIPS 2022: New Orleans, LA, USA",2022,http://papers.nips.cc/paper_files/paper/2022/hash/7a9745f251508a053425a256490b0665-Abstract-Conference.html
Federated Learning from Pre-Trained Models: A Contrastive Learning Approach.,"Yue Tan, Guodong Long, Jie Ma, Lu Liu, Tianyi Zhou, Jing Jiang","36th NeurIPS 2022: New Orleans, LA, USA",2022,http://papers.nips.cc/paper_files/paper/2022/hash/7aa320d2b4b8f6400b18f6f77b6c1535-Abstract-Conference.html
Theoretically Provable Spiking Neural Networks.,"Shao-Qun Zhang, Zhi-Hua Zhou","36th NeurIPS 2022: New Orleans, LA, USA",2022,http://papers.nips.cc/paper_files/paper/2022/hash/7abbcb05a5d55157ede410bb718e32d7-Abstract-Conference.html
Approximate Euclidean lengths and distances beyond Johnson-Lindenstrauss.,"Aleksandros Sobczyk, Mathieu Luisier","36th NeurIPS 2022: New Orleans, LA, USA",2022,http://papers.nips.cc/paper_files/paper/2022/hash/7ac1846846f02b42dcfab5c40bc6ae56-Abstract-Conference.html
InsPro: Propagating Instance Query and Proposal for Online Video Instance Segmentation.,"Fei He, Haoyang Zhang, Naiyu Gao, Jian Jia, Yanhu Shan, Xin Zhao, Kaiqi Huang","36th NeurIPS 2022: New Orleans, LA, USA",2022,http://papers.nips.cc/paper_files/paper/2022/hash/7ac19fdcdf4f311f3e3ef2e7ef4784d7-Abstract-Conference.html
Measuring and Reducing Model Update Regression in Structured Prediction for NLP.,"Deng Cai, Elman Mansimov, Yi-An Lai, Yixuan Su, Lei Shu, Yi Zhang","36th NeurIPS 2022: New Orleans, LA, USA",2022,http://papers.nips.cc/paper_files/paper/2022/hash/7af8e3dfefe6e3141144197b8fa44f79-Abstract-Conference.html
Rethinking Lipschitz Neural Networks and Certified Robustness: A Boolean Function Perspective.,"Bohang Zhang, Du Jiang, Di He, Liwei Wang","36th NeurIPS 2022: New Orleans, LA, USA",2022,http://papers.nips.cc/paper_files/paper/2022/hash/7b04ec5f2b89d7f601382c422dfe07af-Abstract-Conference.html
Multivariate Time-Series Forecasting with Temporal Polynomial Graph Neural Networks.,"Yijing Liu, Qinxian Liu, Jian-Wei Zhang, Haozhe Feng, Zhongwei Wang, Zihan Zhou, Wei Chen","36th NeurIPS 2022: New Orleans, LA, USA",2022,http://papers.nips.cc/paper_files/paper/2022/hash/7b102c908e9404dd040599c65db4ce3e-Abstract-Conference.html
Few-shot Image Generation via Adaptation-Aware Kernel Modulation.,"Yunqing Zhao, Keshigeyan Chandrasegaran, Milad Abdollahzadeh, Ngai-Man Cheung","36th NeurIPS 2022: New Orleans, LA, USA",2022,http://papers.nips.cc/paper_files/paper/2022/hash/7b122d0a0dcb1a86ffa25ccba154652b-Abstract-Conference.html
Learning to Follow Instructions in Text-Based Games.,"Mathieu Tuli, Andrew C. Li, Pashootan Vaezipoor, Toryn Q. Klassen, Scott Sanner, Sheila A. McIlraith","36th NeurIPS 2022: New Orleans, LA, USA",2022,http://papers.nips.cc/paper_files/paper/2022/hash/7b24015f3af598e1d9179f6e06353780-Abstract-Conference.html
Concentration of Data Encoding in Parameterized Quantum Circuits.,"Guangxi Li, Ruilin Ye, Xuanqiang Zhao, Xin Wang","36th NeurIPS 2022: New Orleans, LA, USA",2022,http://papers.nips.cc/paper_files/paper/2022/hash/7b2d0730df1edd8c97df4bf83696025d-Abstract-Conference.html
Improving Variational Autoencoders with Density Gap-based Regularization.,"Jianfei Zhang, Jun Bai, Chenghua Lin, Yanmeng Wang, Wenge Rong","36th NeurIPS 2022: New Orleans, LA, USA",2022,http://papers.nips.cc/paper_files/paper/2022/hash/7b2e844c52349134268e819a9b56b9e8-Abstract-Conference.html
RISE: Robust Individualized Decision Learning with Sensitive Variables.,"Xiaoqing Tan, Zhengling Qi, Christopher W. Seymour, Lu Tang","36th NeurIPS 2022: New Orleans, LA, USA",2022,http://papers.nips.cc/paper_files/paper/2022/hash/7b2f0758334389b8ad0665a9bd165463-Abstract-Conference.html
Bayesian Clustering of Neural Spiking Activity Using a Mixture of Dynamic Poisson Factor Analyzers.,"Ganchao Wei, Ian H. Stevenson, Xiaojing Wang","36th NeurIPS 2022: New Orleans, LA, USA",2022,http://papers.nips.cc/paper_files/paper/2022/hash/7b39f4512a2e3899edcc59c7501f3cd4-Abstract-Conference.html
Understanding Deep Contrastive Learning via Coordinate-wise Optimization.,Yuandong Tian,"36th NeurIPS 2022: New Orleans, LA, USA",2022,http://papers.nips.cc/paper_files/paper/2022/hash/7b5c9cc08960df40615c1d858961eb8b-Abstract-Conference.html
Beyond neural scaling laws: beating power law scaling via data pruning.,"Ben Sorscher, Robert Geirhos, Shashank Shekhar, Surya Ganguli, Ari Morcos","36th NeurIPS 2022: New Orleans, LA, USA",2022,http://papers.nips.cc/paper_files/paper/2022/hash/7b75da9b61eda40fa35453ee5d077df6-Abstract-Conference.html
Neural Estimation of Submodular Functions with Applications to Differentiable Subset Selection.,"Abir De, Soumen Chakrabarti","36th NeurIPS 2022: New Orleans, LA, USA",2022,http://papers.nips.cc/paper_files/paper/2022/hash/7b76eea0c3683e440c3d362620f578cd-Abstract-Conference.html
Maximum Class Separation as Inductive Bias in One Matrix.,"Tejaswi Kasarla, Gertjan J. Burghouts, Max van Spengler, Elise van der Pol, Rita Cucchiara, Pascal Mettes","36th NeurIPS 2022: New Orleans, LA, USA",2022,http://papers.nips.cc/paper_files/paper/2022/hash/7b95e1ca9d7347da59cefd362e60a0b6-Abstract-Conference.html
Surprising Instabilities in Training Deep Networks and a Theoretical Analysis.,"Yuxin Sun, Dong Lao, Ganesh Sundaramoorthi, Anthony J. Yezzi","36th NeurIPS 2022: New Orleans, LA, USA",2022,http://papers.nips.cc/paper_files/paper/2022/hash/7b97adeafa1c51cf65263459ca9d0d7c-Abstract-Conference.html
WaveBound: Dynamic Error Bounds for Stable Time Series Forecasting.,"Youngin Cho, Daejin Kim, Dongmin Kim, Mohammad Azam Khan, Jaegul Choo","36th NeurIPS 2022: New Orleans, LA, USA",2022,http://papers.nips.cc/paper_files/paper/2022/hash/7b99e3c648898b9e4923dea0aeb4afa1-Abstract-Conference.html
Finite-Time Analysis of Adaptive Temporal Difference Learning with Deep Neural Networks.,"Tao Sun, Dongsheng Li, Bao Wang","36th NeurIPS 2022: New Orleans, LA, USA",2022,http://papers.nips.cc/paper_files/paper/2022/hash/7b9ebf1a1c149960c3452dc94cbd158e-Abstract-Conference.html
Benign Underfitting of Stochastic Gradient Descent.,"Tomer Koren, Roi Livni, Yishay Mansour, Uri Sherman","36th NeurIPS 2022: New Orleans, LA, USA",2022,http://papers.nips.cc/paper_files/paper/2022/hash/7bc4f74e35bcfe8cfe43b0a860786d6a-Abstract-Conference.html
A Geometric Perspective on Variational Autoencoders.,"Clément Chadebec, Stéphanie Allassonnière","36th NeurIPS 2022: New Orleans, LA, USA",2022,http://papers.nips.cc/paper_files/paper/2022/hash/7bf1dc45f850b8ae1b5a1dd4f475f8b6-Abstract-Conference.html
A Data-Augmentation Is Worth A Thousand Samples: Analytical Moments And Sampling-Free Training.,"Randall Balestriero, Ishan Misra, Yann LeCun","36th NeurIPS 2022: New Orleans, LA, USA",2022,http://papers.nips.cc/paper_files/paper/2022/hash/7c080cab957edab671ac49ae11e51337-Abstract-Conference.html
Effective Adaptation in Multi-Task Co-Training for Unified Autonomous Driving.,"Xiwen Liang, Yangxin Wu, Jianhua Han, Hang Xu, Chunjing Xu, Xiaodan Liang","36th NeurIPS 2022: New Orleans, LA, USA",2022,http://papers.nips.cc/paper_files/paper/2022/hash/7c319b62e2257b34cb0e1040ced2e007-Abstract-Conference.html
Redundant representations help generalization in wide neural networks.,"Diego Doimo, Aldo Glielmo, Sebastian Goldt, Alessandro Laio","36th NeurIPS 2022: New Orleans, LA, USA",2022,http://papers.nips.cc/paper_files/paper/2022/hash/7c3a8d20ceadb7c519e9ac1bb77a15ff-Abstract-Conference.html
Mean Estimation in High-Dimensional Binary Markov Gaussian Mixture Models.,"Yihan Zhang, Nir Weinberger","36th NeurIPS 2022: New Orleans, LA, USA",2022,http://papers.nips.cc/paper_files/paper/2022/hash/7c40c5050bd029a3ea7ff8b01412f735-Abstract-Conference.html
Rate-Distortion Theoretic Bounds on Generalization Error for Distributed Learning.,"Milad Sefidgaran, Romain Chor, Abdellatif Zaidi","36th NeurIPS 2022: New Orleans, LA, USA",2022,http://papers.nips.cc/paper_files/paper/2022/hash/7c61aa6a4dcf12042fe12a31d49d6390-Abstract-Conference.html
Online Frank-Wolfe with Arbitrary Delays.,"Yuanyu Wan, Wei-Wei Tu, Lijun Zhang","36th NeurIPS 2022: New Orleans, LA, USA",2022,http://papers.nips.cc/paper_files/paper/2022/hash/7c799b09cc40973ceaa47da50131dc63-Abstract-Conference.html
Isometric 3D Adversarial Examples in the Physical World.,"Yibo Miao, Yinpeng Dong, Jun Zhu, Xiao-Shan Gao","36th NeurIPS 2022: New Orleans, LA, USA",2022,http://papers.nips.cc/paper_files/paper/2022/hash/7c818dd40651b420873af70b8a790e3f-Abstract-Conference.html
Tight Lower Bounds on Worst-Case Guarantees for Zero-Shot Learning with Attributes.,"Alessio Mazzetto, Cristina Menghini, Andrew Yuan, Eli Upfal, Stephen H. Bach","36th NeurIPS 2022: New Orleans, LA, USA",2022,http://papers.nips.cc/paper_files/paper/2022/hash/7c9b9ecc92a679f1b6c76ed8f99f2636-Abstract-Conference.html
Graph Neural Networks with Adaptive Readouts.,"David Buterez, Jon Paul Janet, Steven J. Kiddle, Dino Oglic, Pietro Liò","36th NeurIPS 2022: New Orleans, LA, USA",2022,http://papers.nips.cc/paper_files/paper/2022/hash/7caf9d251b546bc78078b35b4a6f3b7e-Abstract-Conference.html
Robust Imitation of a Few Demonstrations with a Backwards Model.,"Jung Yeon Park, Lawson L. S. Wong","36th NeurIPS 2022: New Orleans, LA, USA",2022,http://papers.nips.cc/paper_files/paper/2022/hash/7ce5da35e01cfa8d303c2dc71e61a470-Abstract-Conference.html
Communication Efficient Distributed Learning for Kernelized Contextual Bandits.,"Chuanhao Li, Huazheng Wang, Mengdi Wang, Hongning Wang","36th NeurIPS 2022: New Orleans, LA, USA",2022,http://papers.nips.cc/paper_files/paper/2022/hash/7d1043b688002734b49b766cc2fc478d-Abstract-Conference.html
Trust Region Policy Optimization with Optimal Transport Discrepancies: Duality and Algorithm for Continuous Actions.,"Antonio Terpin, Nicolas Lanzetti, Batuhan Yardim, Florian Dörfler, Giorgia Ramponi","36th NeurIPS 2022: New Orleans, LA, USA",2022,http://papers.nips.cc/paper_files/paper/2022/hash/7d3298e48220b289318b533a848ea069-Abstract-Conference.html
ELIAS: End-to-End Learning to Index and Search in Large Output Spaces.,"Nilesh Gupta, Patrick H. Chen, Hsiang-Fu Yu, Cho-Jui Hsieh, Inderjit S. Dhillon","36th NeurIPS 2022: New Orleans, LA, USA",2022,http://papers.nips.cc/paper_files/paper/2022/hash/7d4f98f916494121aca3da02e36a4d18-Abstract-Conference.html
GStarX: Explaining Graph Neural Networks with Structure-Aware Cooperative Games.,"Shichang Zhang, Yozen Liu, Neil Shah, Yizhou Sun","36th NeurIPS 2022: New Orleans, LA, USA",2022,http://papers.nips.cc/paper_files/paper/2022/hash/7d53575463291ea6b5a23cf6e571f59b-Abstract-Conference.html
Bridging the Gap from Asymmetry Tricks to Decorrelation Principles in Non-contrastive Self-supervised Learning.,"Kang-Jun Liu, Masanori Suganuma, Takayuki Okatani","36th NeurIPS 2022: New Orleans, LA, USA",2022,http://papers.nips.cc/paper_files/paper/2022/hash/7d535a224c8ae54ba75bac0457b6b279-Abstract-Conference.html
Lipschitz Bandits with Batched Feedback.,"Yasong Feng, Zengfeng Huang, Tianyu Wang","36th NeurIPS 2022: New Orleans, LA, USA",2022,http://papers.nips.cc/paper_files/paper/2022/hash/7d6ab81bfaa3a3ea45833e21907453c3-Abstract-Conference.html
Improving Barely Supervised Learning by Discriminating Unlabeled Samples with Super-Class.,"Guan Gui, Zhen Zhao, Lei Qi, Luping Zhou, Lei Wang, Yinghuan Shi","36th NeurIPS 2022: New Orleans, LA, USA",2022,http://papers.nips.cc/paper_files/paper/2022/hash/7d90c28e7820709792d969211815a2b3-Abstract-Conference.html
Low-Rank Modular Reinforcement Learning via Muscle Synergy.,"Heng Dong, Tonghan Wang, Jiayuan Liu, Chongjie Zhang","36th NeurIPS 2022: New Orleans, LA, USA",2022,http://papers.nips.cc/paper_files/paper/2022/hash/7da6005a8d6942e8b328357da2872aed-Abstract-Conference.html
Neural Temporal Walks: Motif-Aware Representation Learning on Continuous-Time Dynamic Graphs.,"Ming Jin, Yuan-Fang Li, Shirui Pan","36th NeurIPS 2022: New Orleans, LA, USA",2022,http://papers.nips.cc/paper_files/paper/2022/hash/7dadc855cef7494d5d956a8d28add871-Abstract-Conference.html
Understanding Benign Overfitting in Gradient-Based Meta Learning.,"Lisha Chen, Songtao Lu, Tianyi Chen","36th NeurIPS 2022: New Orleans, LA, USA",2022,http://papers.nips.cc/paper_files/paper/2022/hash/7db3470825421b6a7e52d95fb00de62e-Abstract-Conference.html
Generative Neural Articulated Radiance Fields.,"Alexander W. Bergman, Petr Kellnhofer, Wang Yifan, Eric R. Chan, David B. Lindell, Gordon Wetzstein","36th NeurIPS 2022: New Orleans, LA, USA",2022,http://papers.nips.cc/paper_files/paper/2022/hash/7dbafa7d2051218f364c9a38ef1150de-Abstract-Conference.html
AutoMS: Automatic Model Selection for Novelty Detection with Error Rate Control.,"Yifan Zhang, Haiyan Jiang, Haojie Ren, Changliang Zou, Dejing Dou","36th NeurIPS 2022: New Orleans, LA, USA",2022,http://papers.nips.cc/paper_files/paper/2022/hash/7dced224614f3c50b1626473f48312bf-Abstract-Conference.html
GALOIS: Boosting Deep Reinforcement Learning via Generalizable Logic Synthesis.,"Yushi Cao, Zhiming Li, Tianpei Yang, Hao Zhang, Yan Zheng, Yi Li, Jianye Hao, Yang Liu","36th NeurIPS 2022: New Orleans, LA, USA",2022,http://papers.nips.cc/paper_files/paper/2022/hash/7dd309df03d37643b96f5048b44da798-Abstract-Conference.html
Faster Deep Reinforcement Learning with Slower Online Network.,"Kavosh Asadi, Rasool Fakoor, Omer Gottesman, Taesup Kim, Michael L. Littman, Alexander J. Smola","36th NeurIPS 2022: New Orleans, LA, USA",2022,http://papers.nips.cc/paper_files/paper/2022/hash/7dfa77fcef807c9a078b58fd619ad897-Abstract-Conference.html
Learn to Match with No Regret: Reinforcement Learning in Markov Matching Markets.,"Yifei Min, Tianhao Wang, Ruitu Xu, Zhaoran Wang, Michael I. Jordan, Zhuoran Yang","36th NeurIPS 2022: New Orleans, LA, USA",2022,http://papers.nips.cc/paper_files/paper/2022/hash/7e0af0d1bc0ec2a90fc294be2e00447e-Abstract-Conference.html
Efficient Frameworks for Generalized Low-Rank Matrix Bandit Problems.,"Yue Kang, Cho-Jui Hsieh, Thomas Chun Man Lee","36th NeurIPS 2022: New Orleans, LA, USA",2022,http://papers.nips.cc/paper_files/paper/2022/hash/7e0dc9ccba0f1333be13a3f9dc2b3138-Abstract-Conference.html
A Projection-free Algorithm for Constrained Stochastic Multi-level Composition Optimization.,"Tesi Xiao, Krishnakumar Balasubramanian, Saeed Ghadimi","36th NeurIPS 2022: New Orleans, LA, USA",2022,http://papers.nips.cc/paper_files/paper/2022/hash/7e16384b94a1c7e4462a70bb8fb93ca9-Abstract-Conference.html
Green Hierarchical Vision Transformer for Masked Image Modeling.,"Lang Huang, Shan You, Mingkai Zheng, Fei Wang, Chen Qian, Toshihiko Yamasaki","36th NeurIPS 2022: New Orleans, LA, USA",2022,http://papers.nips.cc/paper_files/paper/2022/hash/7e487c72fce6e45879a78ee0872d991d-Abstract-Conference.html
Simultaneous Missing Value Imputation and Structure Learning with Groups.,"Pablo Morales-Alvarez, Wenbo Gong, Angus Lamb, Simon Woodhead, Simon Peyton Jones, Nick Pawlowski, Miltiadis Allamanis, Cheng Zhang","36th NeurIPS 2022: New Orleans, LA, USA",2022,http://papers.nips.cc/paper_files/paper/2022/hash/7e57131fdeb815764434b65162c88895-Abstract-Conference.html
Towards Reliable Simulation-Based Inference with Balanced Neural Ratio Estimation.,"Arnaud Delaunoy, Joeri Hermans, François Rozet, Antoine Wehenkel, Gilles Louppe","36th NeurIPS 2022: New Orleans, LA, USA",2022,http://papers.nips.cc/paper_files/paper/2022/hash/7e6288bfb68182db7d6e328b0aefa89a-Abstract-Conference.html
Interaction Modeling with Multiplex Attention.,"Fan-Yun Sun, Isaac Kauvar, Ruohan Zhang, Jiachen Li, Mykel J. Kochenderfer, Jiajun Wu, Nick Haber","36th NeurIPS 2022: New Orleans, LA, USA",2022,http://papers.nips.cc/paper_files/paper/2022/hash/7e6361a5d73a8fab093dd8453e0b106f-Abstract-Conference.html
Low-rank lottery tickets: finding efficient low-rank neural networks via matrix differential equations.,"Steffen Schotthöfer, Emanuele Zangrando, Jonas Kusch, Gianluca Ceruti, Francesco Tudisco","36th NeurIPS 2022: New Orleans, LA, USA",2022,http://papers.nips.cc/paper_files/paper/2022/hash/7e98b00eeafcdaeb0c5661fb9355be3a-Abstract-Conference.html
Causality-driven Hierarchical Structure Discovery for Reinforcement Learning.,"Shaohui Peng, Xing Hu, Rui Zhang, Ke Tang, Jiaming Guo, Qi Yi, Ruizhi Chen, Xishan Zhang, Zidong Du, Ling Li, Qi Guo, Yunji Chen","36th NeurIPS 2022: New Orleans, LA, USA",2022,http://papers.nips.cc/paper_files/paper/2022/hash/7e9fbd01b3084956dd8a070c7bf30bad-Abstract-Conference.html
Pay attention to your loss : understanding misconceptions about Lipschitz neural networks.,"Louis Béthune, Thibaut Boissin, Mathieu Serrurier, Franck Mamalet, Corentin Friedrich, Alberto González-Sanz","36th NeurIPS 2022: New Orleans, LA, USA",2022,http://papers.nips.cc/paper_files/paper/2022/hash/7eb3d8ae592966543170a65e6b698828-Abstract-Conference.html
Large-Scale Retrieval for Reinforcement Learning.,"Peter Conway Humphreys, Arthur Guez, Olivier Tieleman, Laurent Sifre, Theophane Weber, Timothy P. Lillicrap","36th NeurIPS 2022: New Orleans, LA, USA",2022,http://papers.nips.cc/paper_files/paper/2022/hash/7eca17ef54789b0663cab421f2e9dbf5-Abstract-Conference.html
Gradient flow dynamics of shallow ReLU networks for square loss and orthogonal inputs.,"Etienne Boursier, Loucas Pillaud-Vivien, Nicolas Flammarion","36th NeurIPS 2022: New Orleans, LA, USA",2022,http://papers.nips.cc/paper_files/paper/2022/hash/7eeb9af3eb1f48e29c05e8dd3342b286-Abstract-Conference.html
Weisfeiler and Leman Go Walking: Random Walk Kernels Revisited.,Nils M. Kriege,"36th NeurIPS 2022: New Orleans, LA, USA",2022,http://papers.nips.cc/paper_files/paper/2022/hash/7eed2822411dc37b3768ae04561caafa-Abstract-Conference.html
Outsourcing Training without Uploading Data via Efficient Collaborative Open-Source Sampling.,"Junyuan Hong, Lingjuan Lyu, Jiayu Zhou, Michael Spranger","36th NeurIPS 2022: New Orleans, LA, USA",2022,http://papers.nips.cc/paper_files/paper/2022/hash/7efe88bb4138d602e56637cfcf713654-Abstract-Conference.html
Multi-agent Dynamic Algorithm Configuration.,"Ke Xue, Jiacheng Xu, Lei Yuan, Miqing Li, Chao Qian, Zongzhang Zhang, Yang Yu","36th NeurIPS 2022: New Orleans, LA, USA",2022,http://papers.nips.cc/paper_files/paper/2022/hash/7f02b39c0424cc4a422994289ca03e46-Abstract-Conference.html
TaSIL: Taylor Series Imitation Learning.,"Daniel Pfrommer, Thomas T. C. K. Zhang, Stephen Tu, Nikolai Matni","36th NeurIPS 2022: New Orleans, LA, USA",2022,http://papers.nips.cc/paper_files/paper/2022/hash/7f10c3d66c3b7863a9cda255dcac5bb7-Abstract-Conference.html
Experimental Design for Linear Functionals in Reproducing Kernel Hilbert Spaces.,"Mojmir Mutny, Andreas Krause","36th NeurIPS 2022: New Orleans, LA, USA",2022,http://papers.nips.cc/paper_files/paper/2022/hash/7f2223201858b6ff4cc1832d8856459b-Abstract-Conference.html
Continuous MDP Homomorphisms and Homomorphic Policy Gradient.,"Sahand Rezaei-Shoshtari, Rosie Zhao, Prakash Panangaden, David Meger, Doina Precup","36th NeurIPS 2022: New Orleans, LA, USA",2022,http://papers.nips.cc/paper_files/paper/2022/hash/7f44f98e5e70dea605d0c5baca231c58-Abstract-Conference.html
Score-based Generative Modeling Secretly Minimizes the Wasserstein Distance.,"Dohyun Kwon, Ying Fan, Kangwook Lee","36th NeurIPS 2022: New Orleans, LA, USA",2022,http://papers.nips.cc/paper_files/paper/2022/hash/7f52f6b8f107931127eefe15429ee278-Abstract-Conference.html
Uncertainty-Aware Reinforcement Learning for Risk-Sensitive Player Evaluation in Sports Game.,"Guiliang Liu, Yudong Luo, Oliver Schulte, Pascal Poupart","36th NeurIPS 2022: New Orleans, LA, USA",2022,http://papers.nips.cc/paper_files/paper/2022/hash/7f6e51d8298aa01b084b700ab91aff94-Abstract-Conference.html
End-to-end Algorithm Synthesis with Recurrent Networks: Extrapolation without Overthinking.,"Arpit Bansal, Avi Schwarzschild, Eitan Borgnia, Zeyad Emam, Furong Huang, Micah Goldblum, Tom Goldstein","36th NeurIPS 2022: New Orleans, LA, USA",2022,http://papers.nips.cc/paper_files/paper/2022/hash/7f70331dbe58ad59d83941dfa7d975aa-Abstract-Conference.html
Smooth Fictitious Play in Stochastic Games with Perturbed Payoffs and Unknown Transitions.,"Lucas Baudin, Rida Laraki","36th NeurIPS 2022: New Orleans, LA, USA",2022,http://papers.nips.cc/paper_files/paper/2022/hash/7f7fa581cc8a1970a4332920cdf87395-Abstract-Conference.html
OOD Link Prediction Generalization Capabilities of Message-Passing GNNs in Larger Test Graphs.,"Yangze Zhou, Gitta Kutyniok, Bruno Ribeiro","36th NeurIPS 2022: New Orleans, LA, USA",2022,http://papers.nips.cc/paper_files/paper/2022/hash/7f88a8478c4ae97819ccffa1e80e7a7b-Abstract-Conference.html
Algorithms with Prediction Portfolios.,"Michael Dinitz, Sungjin Im, Thomas Lavastida, Benjamin Moseley, Sergei Vassilvitskii","36th NeurIPS 2022: New Orleans, LA, USA",2022,http://papers.nips.cc/paper_files/paper/2022/hash/7f9220f90cc85b0da693643add6618e6-Abstract-Conference.html
A Unified Hard-Constraint Framework for Solving Geometrically Complex PDEs.,"Songming Liu, Zhongkai Hao, Chengyang Ying, Hang Su, Jun Zhu, Ze Cheng","36th NeurIPS 2022: New Orleans, LA, USA",2022,http://papers.nips.cc/paper_files/paper/2022/hash/7f970edb14104b81e70e3b03e1f5214f-Abstract-Conference.html
Instability and Local Minima in GAN Training with Kernel Discriminators.,"Evan Becker, Parthe Pandit, Sundeep Rangan, Alyson K. Fletcher","36th NeurIPS 2022: New Orleans, LA, USA",2022,http://papers.nips.cc/paper_files/paper/2022/hash/7f9a44cb707ede42a659ad85d940dd55-Abstract-Conference.html
Versatile Multi-stage Graph Neural Network for Circuit Representation.,"Shuwen Yang, Zhihao Yang, Dong Li, Yingxue Zhang, Zhanguang Zhang, Guojie Song, Jianye Hao","36th NeurIPS 2022: New Orleans, LA, USA",2022,http://papers.nips.cc/paper_files/paper/2022/hash/7fa548155f40c014372146be387c4f6a-Abstract-Conference.html
Non-Stationary Bandits under Recharging Payoffs: Improved Planning with Sublinear Regret.,"Orestis Papadigenopoulos, Constantine Caramanis, Sanjay Shakkottai","36th NeurIPS 2022: New Orleans, LA, USA",2022,http://papers.nips.cc/paper_files/paper/2022/hash/7fccdff3f1457cb7b846596c76c23abd-Abstract-Conference.html
Optimal and Adaptive Monteiro-Svaiter Acceleration.,"Yair Carmon, Danielle Hausler, Arun Jambulapati, Yujia Jin, Aaron Sidford","36th NeurIPS 2022: New Orleans, LA, USA",2022,http://papers.nips.cc/paper_files/paper/2022/hash/7ff97417474268e6b5a38bcbfae04944-Abstract-Conference.html
Chroma-VAE: Mitigating Shortcut Learning with Generative Classifiers.,"Wanqian Yang, Polina Kirichenko, Micah Goldblum, Andrew Gordon Wilson","36th NeurIPS 2022: New Orleans, LA, USA",2022,http://papers.nips.cc/paper_files/paper/2022/hash/80098914b3b3bad79b80377751a85430-Abstract-Conference.html
SparCL: Sparse Continual Learning on the Edge.,"Zifeng Wang, Zheng Zhan, Yifan Gong, Geng Yuan, Wei Niu, Tong Jian, Bin Ren, Stratis Ioannidis, Yanzhi Wang, Jennifer G. Dy","36th NeurIPS 2022: New Orleans, LA, USA",2022,http://papers.nips.cc/paper_files/paper/2022/hash/80133d0f6eccaace15508f91e3c5a93c-Abstract-Conference.html
Adaptively Exploiting d-Separators with Causal Bandits.,"Blair L. Bilodeau, Linbo Wang, Daniel M. Roy","36th NeurIPS 2022: New Orleans, LA, USA",2022,http://papers.nips.cc/paper_files/paper/2022/hash/801ec05b0aae9fcd2ef35c168bd538e0-Abstract-Conference.html
