title,authors,conference_name,conference_year,link
Federated Submodel Optimization for Hot and Cold Data Features.,"Yucheng Ding, Chaoyue Niu, Fan Wu, Shaojie Tang, Chengfei Lyu, Yanghe Feng, Guihai Chen","36th NeurIPS 2022: New Orleans, LA, USA",2022,http://papers.nips.cc/paper_files/paper/2022/hash/002262941c9edfd472a79298b2ac5e17-Abstract-Conference.html
On Kernelized Multi-Armed Bandits with Constraints.,"Xingyu Zhou, Bo Ji","36th NeurIPS 2022: New Orleans, LA, USA",2022,http://papers.nips.cc/paper_files/paper/2022/hash/00295cede6e1600d344b5cd6d9fd4640-Abstract-Conference.html
Geometric Order Learning for Rank Estimation.,"Seon-Ho Lee, Nyeong-Ho Shin, Chang-Su Kim","36th NeurIPS 2022: New Orleans, LA, USA",2022,http://papers.nips.cc/paper_files/paper/2022/hash/00358de35a101a372ea0412bed913c86-Abstract-Conference.html
Structured Recognition for Generative Models with Explaining Away.,"Changmin Yu, Hugo Soulat, Neil Burgess, Maneesh Sahani","36th NeurIPS 2022: New Orleans, LA, USA",2022,http://papers.nips.cc/paper_files/paper/2022/hash/003a96110b7134d678cb675c6aea6c7d-Abstract-Conference.html
NAS-Bench-Graph: Benchmarking Graph Neural Architecture Search.,"Yijian Qin, Ziwei Zhang, Xin Wang, Zeyang Zhang, Wenwu Zhu","36th NeurIPS 2022: New Orleans, LA, USA",2022,http://papers.nips.cc/paper_files/paper/2022/hash/004bed4e186fdd7ebb73aad6e97c2332-Abstract-Datasets_and_Benchmarks.html
Fast Bayesian Coresets via Subsampling and Quasi-Newton Refinement.,"Cian Naik, Judith Rousseau, Trevor Campbell","36th NeurIPS 2022: New Orleans, LA, USA",2022,http://papers.nips.cc/paper_files/paper/2022/hash/005413e90d003d13886019607b037f52-Abstract-Conference.html
What You See is What You Classify: Black Box Attributions.,"Steven Stalder, Nathanaël Perraudin, Radhakrishna Achanta, Fernando Pérez-Cruz, Michele Volpi","36th NeurIPS 2022: New Orleans, LA, USA",2022,http://papers.nips.cc/paper_files/paper/2022/hash/0073cc73e1873b35345209b50a3dab66-Abstract-Conference.html
Adaptive Interest for Emphatic Reinforcement Learning.,"Martin Klissarov, Rasool Fakoor, Jonas W. Mueller, Kavosh Asadi, Taesup Kim, Alexander J. Smola","36th NeurIPS 2022: New Orleans, LA, USA",2022,http://papers.nips.cc/paper_files/paper/2022/hash/008079ec00eec9760ee93af5434ee932-Abstract-Conference.html
Scaling & Shifting Your Features: A New Baseline for Efficient Model Tuning.,"Dongze Lian, Daquan Zhou, Jiashi Feng, Xinchao Wang","36th NeurIPS 2022: New Orleans, LA, USA",2022,http://papers.nips.cc/paper_files/paper/2022/hash/00bb4e415ef117f2dee2fc3b778d806d-Abstract-Conference.html
Zero-Shot Video Question Answering via Frozen Bidirectional Language Models.,"Antoine Yang, Antoine Miech, Josef Sivic, Ivan Laptev, Cordelia Schmid","36th NeurIPS 2022: New Orleans, LA, USA",2022,http://papers.nips.cc/paper_files/paper/2022/hash/00d1f03b87a401b1c7957e0cc785d0bc-Abstract-Conference.html
Active Learning with Neural Networks: Insights from Nonparametric Statistics.,"Yinglun Zhu, Robert Nowak","36th NeurIPS 2022: New Orleans, LA, USA",2022,http://papers.nips.cc/paper_files/paper/2022/hash/01025a4e79355bb37a10ba39605944b5-Abstract-Conference.html
IM-Loss: Information Maximization Loss for Spiking Neural Networks.,"Yufei Guo, Yuanpei Chen, Liwen Zhang, Xiaode Liu, YingLei Wang, Xuhui Huang, Zhe Ma","36th NeurIPS 2022: New Orleans, LA, USA",2022,http://papers.nips.cc/paper_files/paper/2022/hash/010c5ba0cafc743fece8be02e7adb8dd-Abstract-Conference.html
Using natural language and program abstractions to instill human inductive biases in machines.,"Sreejan Kumar, Carlos G. Correa, Ishita Dasgupta, Raja Marjieh, Michael Y. Hu, Robert D. Hawkins, Jonathan D. Cohen, Nathaniel D. Daw, Karthik Narasimhan, Tom Griffiths","36th NeurIPS 2022: New Orleans, LA, USA",2022,http://papers.nips.cc/paper_files/paper/2022/hash/0113ef4642264adc2e6924a3cbbdf532-Abstract-Conference.html
Second Thoughts are Best: Learning to Re-Align With Human Values from Text Edits.,"Ruibo Liu, Chenyan Jia, Ge Zhang, Ziyu Zhuang, Tony X. Liu, Soroush Vosoughi","36th NeurIPS 2022: New Orleans, LA, USA",2022,http://papers.nips.cc/paper_files/paper/2022/hash/01c4593d60a020fed5607944330106b1-Abstract-Conference.html
SatMAE: Pre-training Transformers for Temporal and Multi-Spectral Satellite Imagery.,"Yezhen Cong, Samar Khanna, Chenlin Meng, Patrick Liu, Erik Rozi, Yutong He, Marshall Burke, David B. Lobell, Stefano Ermon","36th NeurIPS 2022: New Orleans, LA, USA",2022,http://papers.nips.cc/paper_files/paper/2022/hash/01c561df365429f33fcd7a7faa44c985-Abstract-Conference.html
On Sample Optimality in Personalized Collaborative and Federated Learning.,"Mathieu Even, Laurent Massoulié, Kevin Scaman","36th NeurIPS 2022: New Orleans, LA, USA",2022,http://papers.nips.cc/paper_files/paper/2022/hash/01cea7793f3c68af2e4989fc66bf8fb0-Abstract-Conference.html
Offline Multi-Agent Reinforcement Learning with Knowledge Distillation.,"Wei-Cheng Tseng, Tsun-Hsuan Johnson Wang, Yen-Chen Lin, Phillip Isola","36th NeurIPS 2022: New Orleans, LA, USA",2022,http://papers.nips.cc/paper_files/paper/2022/hash/01d78b294d80491fecddea897cf03642-Abstract-Conference.html
Decentralized Gossip-Based Stochastic Bilevel Optimization over Communication Networks.,"Shuoguang Yang, Xuezhou Zhang, Mengdi Wang","36th NeurIPS 2022: New Orleans, LA, USA",2022,http://papers.nips.cc/paper_files/paper/2022/hash/01db36a646c07c64dd39a92b4eceb417-Abstract-Conference.html
Conditional Meta-Learning of Linear Representations.,"Giulia Denevi, Massimiliano Pontil, Carlo Ciliberto","36th NeurIPS 2022: New Orleans, LA, USA",2022,http://papers.nips.cc/paper_files/paper/2022/hash/01ecd39ca49ddecc5729ca996304781b-Abstract-Conference.html
Theory and Approximate Solvers for Branched Optimal Transport with Multiple Sources.,"Peter Lippmann, Enrique Fita Sanmartín, Fred A. Hamprecht","36th NeurIPS 2022: New Orleans, LA, USA",2022,http://papers.nips.cc/paper_files/paper/2022/hash/0206c1c20a18915da23df5e61966fc6a-Abstract-Conference.html
CHIMLE: Conditional Hierarchical IMLE for Multimodal Conditional Image Synthesis.,"Shichong Peng, Seyed Alireza Moazenipourasil, Ke Li","36th NeurIPS 2022: New Orleans, LA, USA",2022,http://papers.nips.cc/paper_files/paper/2022/hash/0207c9ea9faf66c6e892c3fa3c167b75-Abstract-Conference.html
Active Ranking without Strong Stochastic Transitivity.,"Hao Lou, Tao Jin, Yue Wu, Pan Xu, Quanquan Gu, Farzad Farnoud","36th NeurIPS 2022: New Orleans, LA, USA",2022,http://papers.nips.cc/paper_files/paper/2022/hash/020e313d40a7c060ed07a10cef287750-Abstract-Conference.html
Offline Goal-Conditioned Reinforcement Learning via $f$-Advantage Regression.,"Yecheng Jason Ma, Jason Yan, Dinesh Jayaraman, Osbert Bastani","36th NeurIPS 2022: New Orleans, LA, USA",2022,http://papers.nips.cc/paper_files/paper/2022/hash/022a39052abf9ca467e268923057dfc0-Abstract-Conference.html
Rethinking and Improving Robustness of Convolutional Neural Networks: a Shapley Value-based Approach in Frequency Domain.,"Yiting Chen, Qibing Ren, Junchi Yan","36th NeurIPS 2022: New Orleans, LA, USA",2022,http://papers.nips.cc/paper_files/paper/2022/hash/022abe84083d235f7572ca5cba24c51c-Abstract-Conference.html
Adversarial Style Augmentation for Domain Generalized Urban-Scene Segmentation.,"Zhun Zhong, Yuyang Zhao, Gim Hee Lee, Nicu Sebe","36th NeurIPS 2022: New Orleans, LA, USA",2022,http://papers.nips.cc/paper_files/paper/2022/hash/023d94f44110b9a3c62329beec739772-Abstract-Conference.html
Fully Sparse 3D Object Detection.,"Lue Fan, Feng Wang, Naiyan Wang, Zhaoxiang Zhang","36th NeurIPS 2022: New Orleans, LA, USA",2022,http://papers.nips.cc/paper_files/paper/2022/hash/0247fa3c511bbc415c8b768ee7b32f9e-Abstract-Conference.html
Diffusion Visual Counterfactual Explanations.,"Maximilian Augustin, Valentyn Boreiko, Francesco Croce, Matthias Hein","36th NeurIPS 2022: New Orleans, LA, USA",2022,http://papers.nips.cc/paper_files/paper/2022/hash/025f7165a452e7d0b57f1397fed3b0fd-Abstract-Conference.html
Recurrent Video Restoration Transformer with Guided Deformable Attention.,"Jingyun Liang, Yuchen Fan, Xiaoyu Xiang, Rakesh Ranjan, Eddy Ilg, Simon Green, Jiezhang Cao, Kai Zhang, Radu Timofte, Luc Van Gool","36th NeurIPS 2022: New Orleans, LA, USA",2022,http://papers.nips.cc/paper_files/paper/2022/hash/02687e7b22abc64e651be8da74ec610e-Abstract-Conference.html
A Consolidated Cross-Validation Algorithm for Support Vector Machines via Data Reduction.,"Boxiang Wang, Archer Y. Yang","36th NeurIPS 2022: New Orleans, LA, USA",2022,http://papers.nips.cc/paper_files/paper/2022/hash/026aff87942ce636ada884d934cde0ae-Abstract-Conference.html
On-Demand Sampling: Learning Optimally from Multiple Distributions.,"Nika Haghtalab, Michael I. Jordan, Eric Zhao","36th NeurIPS 2022: New Orleans, LA, USA",2022,http://papers.nips.cc/paper_files/paper/2022/hash/02917acec264a52a729b99d9bc857909-Abstract-Conference.html
Asynchronous SGD Beats Minibatch SGD Under Arbitrary Delays.,"Konstantin Mishchenko, Francis R. Bach, Mathieu Even, Blake E. Woodworth","36th NeurIPS 2022: New Orleans, LA, USA",2022,http://papers.nips.cc/paper_files/paper/2022/hash/029df12a9363313c3e41047844ecad94-Abstract-Conference.html
Coresets for Relational Data and The Applications.,"Jiaxiang Chen, Qingyuan Yang, Ruomin Huang, Hu Ding","36th NeurIPS 2022: New Orleans, LA, USA",2022,http://papers.nips.cc/paper_files/paper/2022/hash/029f82afd78288059dc946b105c451fd-Abstract-Conference.html
Model-Based Offline Reinforcement Learning with Pessimism-Modulated Dynamics Belief.,"Kaiyang Guo, Yunfeng Shao, Yanhui Geng","36th NeurIPS 2022: New Orleans, LA, USA",2022,http://papers.nips.cc/paper_files/paper/2022/hash/03469b1a66e351b18272be23baf3b809-Abstract-Conference.html
Generating Training Data with Language Models: Towards Zero-Shot Language Understanding.,"Yu Meng, Jiaxin Huang, Yu Zhang, Jiawei Han","36th NeurIPS 2022: New Orleans, LA, USA",2022,http://papers.nips.cc/paper_files/paper/2022/hash/0346c148ba1c21c6b4780a961ea141dc-Abstract-Conference.html
Wavelet Score-Based Generative Modeling.,"Florentin Guth, Simon Coste, Valentin De Bortoli, Stéphane Mallat","36th NeurIPS 2022: New Orleans, LA, USA",2022,http://papers.nips.cc/paper_files/paper/2022/hash/03474669b759f6d38cdca6fb4eb905f4-Abstract-Conference.html
Robust Binary Models by Pruning Randomly-initialized Networks.,"Chen Liu, Ziqi Zhao, Sabine Süsstrunk, Mathieu Salzmann","36th NeurIPS 2022: New Orleans, LA, USA",2022,http://papers.nips.cc/paper_files/paper/2022/hash/035f23c0ac4cf2b73b9365ba5a98ad56-Abstract-Conference.html
Why do tree-based models still outperform deep learning on typical tabular data?,"Léo Grinsztajn, Edouard Oyallon, Gaël Varoquaux","36th NeurIPS 2022: New Orleans, LA, USA",2022,http://papers.nips.cc/paper_files/paper/2022/hash/0378c7692da36807bdec87ab043cdadc-Abstract-Datasets_and_Benchmarks.html
Generalizing Consistent Multi-Class Classification with Rejection to be Compatible with Arbitrary Losses.,"Yuzhou Cao, Tianchi Cai, Lei Feng, Lihong Gu, Jinjie Gu, Bo An, Gang Niu, Masashi Sugiyama","36th NeurIPS 2022: New Orleans, LA, USA",2022,http://papers.nips.cc/paper_files/paper/2022/hash/03a90e1bb2ceb2ea165424f2d96aa3a1-Abstract-Conference.html
Markovian Interference in Experiments.,"Vivek F. Farias, Andrew A. Li, Tianyi Peng, Andrew Zheng","36th NeurIPS 2022: New Orleans, LA, USA",2022,http://papers.nips.cc/paper_files/paper/2022/hash/03a9a9c1e15850439653bb971a4ad4b3-Abstract-Conference.html
Identifiability and generalizability from multiple experts in Inverse Reinforcement Learning.,"Paul Rolland, Luca Viano, Norman Schürhoff, Boris Nikolov, Volkan Cevher","36th NeurIPS 2022: New Orleans, LA, USA",2022,http://papers.nips.cc/paper_files/paper/2022/hash/03bdba50e3741ac5e3eaa0e55423587e-Abstract-Conference.html
Parallel Tempering With a Variational Reference.,"Nikola Surjanovic, Saifuddin Syed, Alexandre Bouchard-Côté, Trevor Campbell","36th NeurIPS 2022: New Orleans, LA, USA",2022,http://papers.nips.cc/paper_files/paper/2022/hash/03cd3cf3f74d4f9ce5958de269960884-Abstract-Conference.html
Provably Efficient Reinforcement Learning in Partially Observable Dynamical Systems.,"Masatoshi Uehara, Ayush Sekhari, Jason D. Lee, Nathan Kallus, Wen Sun","36th NeurIPS 2022: New Orleans, LA, USA",2022,http://papers.nips.cc/paper_files/paper/2022/hash/03d7e13f0092405804f3a381ade8f3f0-Abstract-Conference.html
Off-Policy Evaluation for Episodic Partially Observable Markov Decision Processes under Non-Parametric Models.,"Rui Miao, Zhengling Qi, Xiaoke Zhang","36th NeurIPS 2022: New Orleans, LA, USA",2022,http://papers.nips.cc/paper_files/paper/2022/hash/03dfa2a7755635f756b160e9f4c6b789-Abstract-Conference.html
Efficient Knowledge Distillation from Model Checkpoints.,"Chaofei Wang, Qisen Yang, Rui Huang, Shiji Song, Gao Huang","36th NeurIPS 2022: New Orleans, LA, USA",2022,http://papers.nips.cc/paper_files/paper/2022/hash/03e0712bf85ebe7cec4f1a7fc53216c9-Abstract-Conference.html
Decoupled Self-supervised Learning for Graphs.,"Teng Xiao, Zhengyu Chen, Zhimeng Guo, Zeyang Zhuang, Suhang Wang","36th NeurIPS 2022: New Orleans, LA, USA",2022,http://papers.nips.cc/paper_files/paper/2022/hash/040c816286b3844fd78f2124eec75f2e-Abstract-Conference.html
Shadow Knowledge Distillation: Bridging Offline and Online Knowledge Transfer.,"Lujun Li, Zhe Jin","36th NeurIPS 2022: New Orleans, LA, USA",2022,http://papers.nips.cc/paper_files/paper/2022/hash/040d3b6af368bf71f952c18da5713b48-Abstract-Conference.html
ComENet: Towards Complete and Efficient Message Passing for 3D Molecular Graphs.,"Limei Wang, Yi Liu, Yuchao Lin, Haoran Liu, Shuiwang Ji","36th NeurIPS 2022: New Orleans, LA, USA",2022,http://papers.nips.cc/paper_files/paper/2022/hash/0418973e545b932939302cb605d06f43-Abstract-Conference.html
VLMbench: A Compositional Benchmark for Vision-and-Language Manipulation.,"Kaizhi Zheng, Xiaotong Chen, Odest Chadwicke Jenkins, Xin Eric Wang","36th NeurIPS 2022: New Orleans, LA, USA",2022,http://papers.nips.cc/paper_files/paper/2022/hash/04543a88eae2683133c1acbef5a6bf77-Abstract-Datasets_and_Benchmarks.html
Tiered Reinforcement Learning: Pessimism in the Face of Uncertainty and Constant Regret.,"Jiawei Huang, Li Zhao, Tao Qin, Wei Chen, Nan Jiang, Tie-Yan Liu","36th NeurIPS 2022: New Orleans, LA, USA",2022,http://papers.nips.cc/paper_files/paper/2022/hash/0463ec87d0ac1e98a6cbe3d95d4e3e35-Abstract-Conference.html
Between Stochastic and Adversarial Online Convex Optimization: Improved Regret Bounds via Smoothness.,"Sarah Sachs, Hédi Hadiji, Tim van Erven, Cristóbal Guzmán","36th NeurIPS 2022: New Orleans, LA, USA",2022,http://papers.nips.cc/paper_files/paper/2022/hash/047aa59e51e3ac7a2422a55468feefd5-Abstract-Conference.html
Differentially Private Learning Needs Hidden State (Or Much Faster Convergence).,"Jiayuan Ye, Reza Shokri","36th NeurIPS 2022: New Orleans, LA, USA",2022,http://papers.nips.cc/paper_files/paper/2022/hash/04b42392f9a3a16aea012395359b8148-Abstract-Conference.html
BR-SNIS: Bias Reduced Self-Normalized Importance Sampling.,"Gabriel Cardoso, Sergey Samsonov, Achille Thin, Eric Moulines, Jimmy Olsson","36th NeurIPS 2022: New Orleans, LA, USA",2022,http://papers.nips.cc/paper_files/paper/2022/hash/04bd683d5428d91c5fbb5a7d2c27064d-Abstract-Conference.html
Learning to Configure Computer Networks with Neural Algorithmic Reasoning.,"Luca Beurer-Kellner, Martin T. Vechev, Laurent Vanbever, Petar Velickovic","36th NeurIPS 2022: New Orleans, LA, USA",2022,http://papers.nips.cc/paper_files/paper/2022/hash/04cc90ec6868b97b7423dc38ced1e35c-Abstract-Conference.html
Early Stage Convergence and Global Convergence of Training Mildly Parameterized Neural Networks.,"Mingze Wang, Chao Ma","36th NeurIPS 2022: New Orleans, LA, USA",2022,http://papers.nips.cc/paper_files/paper/2022/hash/04cda3a5ef307978cb5dbef6ab649380-Abstract-Conference.html
On Divergence Measures for Bayesian Pseudocoresets.,"Balhae Kim, Jungwon Choi, Seanie Lee, Yoonho Lee, Jung-Woo Ha, Juho Lee","36th NeurIPS 2022: New Orleans, LA, USA",2022,http://papers.nips.cc/paper_files/paper/2022/hash/04f8311e7e22eac15d67fe45c242ead8-Abstract-Conference.html
Unsupervised Learning of Equivariant Structure from Sequences.,"Takeru Miyato, Masanori Koyama, Kenji Fukumizu","36th NeurIPS 2022: New Orleans, LA, USA",2022,http://papers.nips.cc/paper_files/paper/2022/hash/0503f5dce343a1d06d16ba103dd52db1-Abstract-Conference.html
Multi-Class $H$-Consistency Bounds.,"Pranjal Awasthi, Anqi Mao, Mehryar Mohri, Yutao Zhong","36th NeurIPS 2022: New Orleans, LA, USA",2022,http://papers.nips.cc/paper_files/paper/2022/hash/051f3997af1dd65da8e14397b6a72f8e-Abstract-Conference.html
On the Frequency-bias of Coordinate-MLPs.,"Sameera Ramasinghe, Lachlan E. MacDonald, Simon Lucey","36th NeurIPS 2022: New Orleans, LA, USA",2022,http://papers.nips.cc/paper_files/paper/2022/hash/0525fa17a8dbea687359116d01732e12-Abstract-Conference.html
DC-BENCH: Dataset Condensation Benchmark.,"Justin Cui, Ruochen Wang, Si Si, Cho-Jui Hsieh","36th NeurIPS 2022: New Orleans, LA, USA",2022,http://papers.nips.cc/paper_files/paper/2022/hash/052e22cfdd344c79634f7ec76fa03e22-Abstract-Datasets_and_Benchmarks.html
Mask Matching Transformer for Few-Shot Segmentation.,"Siyu Jiao, Gengwei Zhang, Shant Navasardyan, Ling Chen, Yao Zhao, Yunchao Wei, Honghui Shi","36th NeurIPS 2022: New Orleans, LA, USA",2022,http://papers.nips.cc/paper_files/paper/2022/hash/053a18c03e0844d0c484ba2861f8ae6c-Abstract-Conference.html
Queue Up Your Regrets: Achieving the Dynamic Capacity Region of Multiplayer Bandits.,"Ilai Bistritz, Nicholas Bambos","36th NeurIPS 2022: New Orleans, LA, USA",2022,http://papers.nips.cc/paper_files/paper/2022/hash/056e8e9c8ca9929cb6cf198952bf1dbb-Abstract-Conference.html
Differentially Private Covariance Revisited.,"Wei Dong, Yuting Liang, Ke Yi","36th NeurIPS 2022: New Orleans, LA, USA",2022,http://papers.nips.cc/paper_files/paper/2022/hash/057405fd73dd7ba7f32a7cb34fb7c7f5-Abstract-Conference.html
Trimmed Maximum Likelihood Estimation for Robust Generalized Linear Model.,"Pranjal Awasthi, Abhimanyu Das, Weihao Kong, Rajat Sen","36th NeurIPS 2022: New Orleans, LA, USA",2022,http://papers.nips.cc/paper_files/paper/2022/hash/05b12f103c9e613efc4c85674cdc9066-Abstract-Conference.html
Causal Discovery in Linear Latent Variable Models Subject to Measurement Error.,"Yuqin Yang, AmirEmad Ghassami, Mohamed S. Nafea, Negar Kiyavash, Kun Zhang, Ilya Shpitser","36th NeurIPS 2022: New Orleans, LA, USA",2022,http://papers.nips.cc/paper_files/paper/2022/hash/05b63fa06784b71aab3939004e0f0a0d-Abstract-Conference.html
Density-driven Regularization for Out-of-distribution Detection.,"Wenjian Huang, Hao Wang, Jiahao Xia, Chengyan Wang, Jianguo Zhang","36th NeurIPS 2022: New Orleans, LA, USA",2022,http://papers.nips.cc/paper_files/paper/2022/hash/05b69cc4c8ff6e24c5de1ecd27223d37-Abstract-Conference.html
Sparsity in Continuous-Depth Neural Networks.,"Hananeh Aliee, Till Richter, Mikhail Solonin, Ignacio Ibarra, Fabian J. Theis, Niki Kilbertus","36th NeurIPS 2022: New Orleans, LA, USA",2022,http://papers.nips.cc/paper_files/paper/2022/hash/0626822954674a06ccd9c234e3f0d572-Abstract-Conference.html
Environment Diversification with Multi-head Neural Network for Invariant Learning.,"Bo-Wei Huang, Keng-Te Liao, Chang-Sheng Kao, Shou-De Lin","36th NeurIPS 2022: New Orleans, LA, USA",2022,http://papers.nips.cc/paper_files/paper/2022/hash/062d711fb777322e2152435459e6e9d9-Abstract-Conference.html
Learning Probabilistic Models from Generator Latent Spaces with Hat EBM.,"Mitch Hill, Erik Nijkamp, Jonathan Mitchell, Bo Pang, Song-Chun Zhu","36th NeurIPS 2022: New Orleans, LA, USA",2022,http://papers.nips.cc/paper_files/paper/2022/hash/062f9525a7476942f61a6c3b42d0a63f-Abstract-Conference.html
Learning Best Combination for Efficient N: M Sparsity.,"Yuxin Zhang, Mingbao Lin, Zhihang Lin, Yiting Luo, Ke Li, Fei Chao, Yongjian Wu, Rongrong Ji","36th NeurIPS 2022: New Orleans, LA, USA",2022,http://papers.nips.cc/paper_files/paper/2022/hash/06589ec9d86876508600a678f9c8f51d-Abstract-Conference.html
Why Do Artificially Generated Data Help Adversarial Robustness.,"Yue Xing, Qifan Song, Guang Cheng","36th NeurIPS 2022: New Orleans, LA, USA",2022,http://papers.nips.cc/paper_files/paper/2022/hash/065e259a1d2d955e63b99aac6a3a3081-Abstract-Conference.html
Neural Surface Reconstruction of Dynamic Scenes with Monocular RGB-D Camera.,"Hongrui Cai, Wanquan Feng, Xuetao Feng, Yan Wang, Juyong Zhang","36th NeurIPS 2022: New Orleans, LA, USA",2022,http://papers.nips.cc/paper_files/paper/2022/hash/06a52a54c8ee03cd86771136bc91eb1f-Abstract-Conference.html
Global Optimal K-Medoids Clustering of One Million Samples.,"Jiayang Ren, Kaixun Hua, Yankai Cao","36th NeurIPS 2022: New Orleans, LA, USA",2022,http://papers.nips.cc/paper_files/paper/2022/hash/06abed94583030dd50abe6767bd643b1-Abstract-Conference.html
Batch Multi-Fidelity Active Learning with Budget Constraints.,"Shibo Li, Jeff M. Phillips, Xin Yu, Robert M. Kirby, Shandian Zhe","36th NeurIPS 2022: New Orleans, LA, USA",2022,http://papers.nips.cc/paper_files/paper/2022/hash/06ea400b9b7cfce6428ec27a371632eb-Abstract-Conference.html
UniCLIP: Unified Framework for Contrastive Language-Image Pre-training.,"Janghyeon Lee, Jongsuk Kim, Hyounguk Shon, Bumsoo Kim, Seung Hwan Kim, Honglak Lee, Junmo Kim","36th NeurIPS 2022: New Orleans, LA, USA",2022,http://papers.nips.cc/paper_files/paper/2022/hash/072fd0525592b43da661e254bbaadc27-Abstract-Conference.html
Efficient Multi-agent Communication via Self-supervised Information Aggregation.,"Cong Guan, Feng Chen, Lei Yuan, Chenghe Wang, Hao Yin, Zongzhang Zhang, Yang Yu","36th NeurIPS 2022: New Orleans, LA, USA",2022,http://papers.nips.cc/paper_files/paper/2022/hash/075b2875e2b671ddd74aeec0ac9f0357-Abstract-Conference.html
Accelerated Training of Physics-Informed Neural Networks (PINNs) using Meshless Discretizations.,"Ramansh Sharma, Varun Shankar","36th NeurIPS 2022: New Orleans, LA, USA",2022,http://papers.nips.cc/paper_files/paper/2022/hash/0764db1151b936aca59249e2c1386101-Abstract-Conference.html
DOPE: Doubly Optimistic and Pessimistic Exploration for Safe Reinforcement Learning.,"Archana Bura, Aria HasanzadeZonuzy, Dileep Kalathil, Srinivas Shakkottai, Jean-François Chamberland","36th NeurIPS 2022: New Orleans, LA, USA",2022,http://papers.nips.cc/paper_files/paper/2022/hash/076a93fd42aa85f5ccee921a01d77dd5-Abstract-Conference.html
Improved Regret Analysis for Variance-Adaptive Linear Bandits and Horizon-Free Linear Mixture MDPs.,"Yeoneung Kim, Insoon Yang, Kwang-Sung Jun","36th NeurIPS 2022: New Orleans, LA, USA",2022,http://papers.nips.cc/paper_files/paper/2022/hash/078fa8f77ce55ef6e9cf79275b88acb0-Abstract-Conference.html
Communication-Efficient Topologies for Decentralized Learning with $O(1)$ Consensus Rate.,"Zhuoqing Song, Weijian Li, Kexin Jin, Lei Shi, Ming Yan, Wotao Yin, Kun Yuan","36th NeurIPS 2022: New Orleans, LA, USA",2022,http://papers.nips.cc/paper_files/paper/2022/hash/0790ef700dd0072f4940abda9b7d0005-Abstract-Conference.html
Moderate-fitting as a Natural Backdoor Defender for Pre-trained Language Models.,"Biru Zhu, Yujia Qin, Ganqu Cui, Yangyi Chen, Weilin Zhao, Chong Fu, Yangdong Deng, Zhiyuan Liu, Jingang Wang, Wei Wu, Maosong Sun, Ming Gu","36th NeurIPS 2022: New Orleans, LA, USA",2022,http://papers.nips.cc/paper_files/paper/2022/hash/0799492e7be38b66d10ead5e8809616d-Abstract-Conference.html
Dataset Distillation via Factorization.,"Songhua Liu, Kai Wang, Xingyi Yang, Jingwen Ye, Xinchao Wang","36th NeurIPS 2022: New Orleans, LA, USA",2022,http://papers.nips.cc/paper_files/paper/2022/hash/07bc722f08f096e6ea7ee99349ff0a86-Abstract-Conference.html
Adaptive Sampling for Discovery.,"Ziping Xu, Eunjae Shim, Ambuj Tewari, Paul M. Zimmerman","36th NeurIPS 2022: New Orleans, LA, USA",2022,http://papers.nips.cc/paper_files/paper/2022/hash/07bc8125400bf4b140c332010756bd9b-Abstract-Conference.html
A Large Scale Search Dataset for Unbiased Learning to Rank.,"Lixin Zou, Haitao Mao, Xiaokai Chu, Jiliang Tang, Wenwen Ye, Shuaiqiang Wang, Dawei Yin","36th NeurIPS 2022: New Orleans, LA, USA",2022,http://papers.nips.cc/paper_files/paper/2022/hash/07f560092a0edceabf55af32a40eaee3-Abstract-Datasets_and_Benchmarks.html
SegNeXt: Rethinking Convolutional Attention Design for Semantic Segmentation.,"Meng-Hao Guo, Cheng-Ze Lu, Qibin Hou, Zhengning Liu, Ming-Ming Cheng, Shi-Min Hu","36th NeurIPS 2022: New Orleans, LA, USA",2022,http://papers.nips.cc/paper_files/paper/2022/hash/08050f40fff41616ccfc3080e60a301a-Abstract-Conference.html
Understanding Hyperdimensional Computing for Parallel Single-Pass Learning.,"Tao Yu, Yichi Zhang, Zhiru Zhang, Christopher De Sa","36th NeurIPS 2022: New Orleans, LA, USA",2022,http://papers.nips.cc/paper_files/paper/2022/hash/080be5eb7e887319ff30c792c2cbc28c-Abstract-Conference.html
Syndicated Bandits: A Framework for Auto Tuning Hyper-parameters in Contextual Bandit Algorithms.,"Qin Ding, Yue Kang, Yi-Wei Liu, Thomas Chun Man Lee, Cho-Jui Hsieh, James Sharpnack","36th NeurIPS 2022: New Orleans, LA, USA",2022,http://papers.nips.cc/paper_files/paper/2022/hash/082e82cae0232f45f27fdd2612c31f8a-Abstract-Conference.html
"Benign, Tempered, or Catastrophic: Toward a Refined Taxonomy of Overfitting.","Neil Mallinar, James B. Simon, Amirhesam Abedsoltan, Parthe Pandit, Mikhail Belkin, Preetum Nakkiran","36th NeurIPS 2022: New Orleans, LA, USA",2022,http://papers.nips.cc/paper_files/paper/2022/hash/08342dc6ab69f23167b4123086ad4d38-Abstract-Conference.html
Pre-trained Adversarial Perturbations.,"Yuanhao Ban, Yinpeng Dong","36th NeurIPS 2022: New Orleans, LA, USA",2022,http://papers.nips.cc/paper_files/paper/2022/hash/084727e8abf90a8365b940036329cb6f-Abstract-Conference.html
