title,authors,conference_name,conference_year,link
Hyperparameter Sensitivity in Deep Outlier Detection: Analysis and a Scalable Hyper-Ensemble Solution.,"Xueying Ding, Lingxiao Zhao, Leman Akoglu","36th NeurIPS 2022: New Orleans, LA, USA",2022,http://papers.nips.cc/paper_files/paper/2022/hash/3e9113e2bc2e700baa7d765470f140e1-Abstract-Conference.html
TVLT: Textless Vision-Language Transformer.,"Zineng Tang, Jaemin Cho, Yixin Nie, Mohit Bansal","36th NeurIPS 2022: New Orleans, LA, USA",2022,http://papers.nips.cc/paper_files/paper/2022/hash/3ea3134345f2e6228a29f35b86bce24d-Abstract-Conference.html
A Deep Reinforcement Learning Framework for Column Generation.,"Cheng Chi, Amine Mohamed Aboussalah, Elias B. Khalil, Juyoung Wang, Zoha Sherkat-Masoumi","36th NeurIPS 2022: New Orleans, LA, USA",2022,http://papers.nips.cc/paper_files/paper/2022/hash/3ecfe5c632afb7d96a2337b18ff99b1f-Abstract-Conference.html
Learning to Drop Out: An Adversarial Approach to Training Sequence VAEs.,"Djordje Miladinovic, Kumar Shridhar, Kushal Jain, Max B. Paulus, Joachim M. Buhmann, Carl Allen","36th NeurIPS 2022: New Orleans, LA, USA",2022,http://papers.nips.cc/paper_files/paper/2022/hash/3ed57b293db0aab7cc30c44f45262348-Abstract-Conference.html
On the Adversarial Robustness of Mixture of Experts.,"Joan Puigcerver, Rodolphe Jenatton, Carlos Riquelme, Pranjal Awasthi, Srinadh Bhojanapalli","36th NeurIPS 2022: New Orleans, LA, USA",2022,http://papers.nips.cc/paper_files/paper/2022/hash/3effb91593c4fb42b1da1528328eff49-Abstract-Conference.html
Safety Guarantees for Neural Network Dynamic Systems via Stochastic Barrier Functions.,"Rayan Mazouz, Karan Muvvala, Akash Ratheesh, Luca Laurenti, Morteza Lahijanian","36th NeurIPS 2022: New Orleans, LA, USA",2022,http://papers.nips.cc/paper_files/paper/2022/hash/3f1f3e38d1ce5653afb81505d3e26618-Abstract-Conference.html
Simple and Optimal Greedy Online Contention Resolution Schemes.,Vasilis Livanos,"36th NeurIPS 2022: New Orleans, LA, USA",2022,http://papers.nips.cc/paper_files/paper/2022/hash/3f45a1768ed452c1706e0a3a272e3bbc-Abstract-Conference.html
Composition Theorems for Interactive Differential Privacy.,Xin Lyu,"36th NeurIPS 2022: New Orleans, LA, USA",2022,http://papers.nips.cc/paper_files/paper/2022/hash/3f52b555967a95ee850fcecbd29ee52d-Abstract-Conference.html
On Margins and Generalisation for Voting Classifiers.,"Felix Biggs, Valentina Zantedeschi, Benjamin Guedj","36th NeurIPS 2022: New Orleans, LA, USA",2022,http://papers.nips.cc/paper_files/paper/2022/hash/3f8675af3da6da231c9e75b889b7f047-Abstract-Conference.html
Effective Backdoor Defense by Exploiting Sensitivity of Poisoned Samples.,"Weixin Chen, Baoyuan Wu, Haoqian Wang","36th NeurIPS 2022: New Orleans, LA, USA",2022,http://papers.nips.cc/paper_files/paper/2022/hash/3f9bbf77fbd858e5b6e39d39fe84ed2e-Abstract-Conference.html
Rethinking the Reverse-engineering of Trojan Triggers.,"Zhenting Wang, Kai Mei, Hailun Ding, Juan Zhai, Shiqing Ma","36th NeurIPS 2022: New Orleans, LA, USA",2022,http://papers.nips.cc/paper_files/paper/2022/hash/3f9bf45ea04c98ad7cb857f951f499e2-Abstract-Conference.html
Antigen-Specific Antibody Design and Optimization with Diffusion-Based Generative Models for Protein Structures.,"Shitong Luo, Yufeng Su, Xingang Peng, Sheng Wang, Jian Peng, Jianzhu Ma","36th NeurIPS 2022: New Orleans, LA, USA",2022,http://papers.nips.cc/paper_files/paper/2022/hash/3fa7d76a0dc1179f1e98d1bc62403756-Abstract-Conference.html
Learning single-index models with shallow neural networks.,"Alberto Bietti, Joan Bruna, Clayton Sanford, Min Jae Song","36th NeurIPS 2022: New Orleans, LA, USA",2022,http://papers.nips.cc/paper_files/paper/2022/hash/3fb6c52aeb11e09053c16eabee74dd7b-Abstract-Conference.html
"Information bottleneck theory of high-dimensional regression: relevancy, efficiency and optimality.","Vudtiwat Ngampruetikorn, David J. Schwab","36th NeurIPS 2022: New Orleans, LA, USA",2022,http://papers.nips.cc/paper_files/paper/2022/hash/3fbcfbc2b4009ae8dfa17a562532d123-Abstract-Conference.html
RainNet: A Large-Scale Imagery Dataset and Benchmark for Spatial Precipitation Downscaling.,"Xuanhong Chen, Kairui Feng, Naiyuan Liu, Bingbing Ni, Yifan Lu, Zhengyan Tong, Ziang Liu","36th NeurIPS 2022: New Orleans, LA, USA",2022,http://papers.nips.cc/paper_files/paper/2022/hash/3fbf0c1ea0716c03dea93bb6be78dd6f-Abstract-Conference.html
Dataset Distillation using Neural Feature Regression.,"Yongchao Zhou, Ehsan Nezhadarya, Jimmy Ba","36th NeurIPS 2022: New Orleans, LA, USA",2022,http://papers.nips.cc/paper_files/paper/2022/hash/3fe2a777282299ecb4f9e7ebb531f0ab-Abstract-Conference.html
ZeroC: A Neuro-Symbolic Model for Zero-shot Concept Recognition and Acquisition at Inference Time.,"Tailin Wu, Megan Tjandrasuwita, Zhengxuan Wu, Xuelin Yang, Kevin Liu, Rok Sosic, Jure Leskovec","36th NeurIPS 2022: New Orleans, LA, USA",2022,http://papers.nips.cc/paper_files/paper/2022/hash/3ff48dde82306fe8f26f3e51dd1054d7-Abstract-Conference.html
Theoretically Better and Numerically Faster Distributed Optimization with Smoothness-Aware Quantization Techniques.,"Bokun Wang, Mher Safaryan, Peter Richtárik","36th NeurIPS 2022: New Orleans, LA, USA",2022,http://papers.nips.cc/paper_files/paper/2022/hash/401de6a666d7672757bdadfc53c3c123-Abstract-Conference.html
Sparse Structure Search for Delta Tuning.,"Shengding Hu, Zhen Zhang, Ning Ding, Yadao Wang, Yasheng Wang, Zhiyuan Liu, Maosong Sun","36th NeurIPS 2022: New Orleans, LA, USA",2022,http://papers.nips.cc/paper_files/paper/2022/hash/4027fc4573ec9114182d1fef37a6321a-Abstract-Conference.html
On the Safety of Interpretable Machine Learning: A Maximum Deviation Approach.,"Dennis Wei, Rahul Nair, Amit Dhurandhar, Kush R. Varshney, Elizabeth Daly, Moninder Singh","36th NeurIPS 2022: New Orleans, LA, USA",2022,http://papers.nips.cc/paper_files/paper/2022/hash/402e12102d6ec3ea3df40ce1b23d423a-Abstract-Conference.html
Non-stationary Transformers: Exploring the Stationarity in Time Series Forecasting.,"Yong Liu, Haixu Wu, Jianmin Wang, Mingsheng Long","36th NeurIPS 2022: New Orleans, LA, USA",2022,http://papers.nips.cc/paper_files/paper/2022/hash/4054556fcaa934b0bf76da52cf4f92cb-Abstract-Conference.html
Risk-Driven Design of Perception Systems.,"Anthony Corso, Sydney M. Katz, Craig Innes, Xin Du, Subramanian Ramamoorthy, Mykel J. Kochenderfer","36th NeurIPS 2022: New Orleans, LA, USA",2022,http://papers.nips.cc/paper_files/paper/2022/hash/40739b3bb584c117b3e2f418d17f63a1-Abstract-Conference.html
A Simple Approach to Automated Spectral Clustering.,"Jicong Fan, Yiheng Tu, Zhao Zhang, Mingbo Zhao, Haijun Zhang","36th NeurIPS 2022: New Orleans, LA, USA",2022,http://papers.nips.cc/paper_files/paper/2022/hash/407fb8c5f3fda374c57d1bb18313ea5d-Abstract-Conference.html
Joint Entropy Search for Multi-Objective Bayesian Optimization.,"Ben Tu, Axel Gandy, Nikolas Kantas, Behrang Shafei","36th NeurIPS 2022: New Orleans, LA, USA",2022,http://papers.nips.cc/paper_files/paper/2022/hash/4086fe59dc3584708468fba0e459f6a7-Abstract-Conference.html
Subgroup Robustness Grows On Trees: An Empirical Baseline Investigation.,"Josh Gardner, Zoran Popovic, Ludwig Schmidt","36th NeurIPS 2022: New Orleans, LA, USA",2022,http://papers.nips.cc/paper_files/paper/2022/hash/408cf1a1d9ff35d5fea7075565dbf434-Abstract-Conference.html
Robustness to Unbounded Smoothness of Generalized SignSGD.,"Michael Crawshaw, Mingrui Liu, Francesco Orabona, Wei Zhang, Zhenxun Zhuang","36th NeurIPS 2022: New Orleans, LA, USA",2022,http://papers.nips.cc/paper_files/paper/2022/hash/40924475a9bf768bdac3725e67745283-Abstract-Conference.html
GhostNetV2: Enhance Cheap Operation with Long-Range Attention.,"Yehui Tang, Kai Han, Jianyuan Guo, Chang Xu, Chao Xu, Yunhe Wang","36th NeurIPS 2022: New Orleans, LA, USA",2022,http://papers.nips.cc/paper_files/paper/2022/hash/40b60852a4abdaa696b5a1a78da34635-Abstract-Conference.html
Analyzing Sharpness along GD Trajectory: Progressive Sharpening and Edge of Stability.,"Zixuan Wang, Zhouzi Li, Jian Li","36th NeurIPS 2022: New Orleans, LA, USA",2022,http://papers.nips.cc/paper_files/paper/2022/hash/40bb79c081828bebdc39d65a82367246-Abstract-Conference.html
You Never Stop Dancing: Non-freezing Dance Generation via Bank-constrained Manifold Projection.,"Jiangxin Sun, Chunyu Wang, Huang Hu, Hanjiang Lai, Zhi Jin, Jian-Fang Hu","36th NeurIPS 2022: New Orleans, LA, USA",2022,http://papers.nips.cc/paper_files/paper/2022/hash/40bfe6177e8aed33c982264cf9e6e62c-Abstract-Conference.html
Nonnegative Tensor Completion via Integer Optimization.,"Caleb Bugg, Chen Chen, Anil Aswani","36th NeurIPS 2022: New Orleans, LA, USA",2022,http://papers.nips.cc/paper_files/paper/2022/hash/40cf260d0c2df13e4286cc0fc0972618-Abstract-Conference.html
LION: Latent Point Diffusion Models for 3D Shape Generation.,"Xiaohui Zeng, Arash Vahdat, Francis Williams, Zan Gojcic, Or Litany, Sanja Fidler, Karsten Kreis","36th NeurIPS 2022: New Orleans, LA, USA",2022,http://papers.nips.cc/paper_files/paper/2022/hash/40e56dabe12095a5fc44a6e4c3835948-Abstract-Conference.html
Distribution-Informed Neural Networks for Domain Adaptation Regression.,"Jun Wu, Jingrui He, Sheng Wang, Kaiyu Guan, Elizabeth A. Ainsworth","36th NeurIPS 2022: New Orleans, LA, USA",2022,http://papers.nips.cc/paper_files/paper/2022/hash/410bbba8388369d8bb5875544d1d4428-Abstract-Conference.html
Momentum Adversarial Distillation: Handling Large Distribution Shifts in Data-Free Knowledge Distillation.,"Kien Do, Hung Le, Dung Nguyen, Dang Nguyen, Haripriya Harikumar, Truyen Tran, Santu Rana, Svetha Venkatesh","36th NeurIPS 2022: New Orleans, LA, USA",2022,http://papers.nips.cc/paper_files/paper/2022/hash/41128e5b3a7622da5b17588757599077-Abstract-Conference.html
Hard ImageNet: Segmentations for Objects with Strong Spurious Cues.,"Mazda Moayeri, Sahil Singla, Soheil Feizi","36th NeurIPS 2022: New Orleans, LA, USA",2022,http://papers.nips.cc/paper_files/paper/2022/hash/4120362f930b0b683cd30b71af56fad1-Abstract-Datasets_and_Benchmarks.html
VideoMAE: Masked Autoencoders are Data-Efficient Learners for Self-Supervised Video Pre-Training.,"Zhan Tong, Yibing Song, Jue Wang, Limin Wang","36th NeurIPS 2022: New Orleans, LA, USA",2022,http://papers.nips.cc/paper_files/paper/2022/hash/416f9cb3276121c42eebb86352a4354a-Abstract-Conference.html
Scalable design of Error-Correcting Output Codes using Discrete Optimization with Graph Coloring.,"Samarth Gupta, Saurabh Amin","36th NeurIPS 2022: New Orleans, LA, USA",2022,http://papers.nips.cc/paper_files/paper/2022/hash/41792f041a3a0774418791993cf887fe-Abstract-Conference.html
A New Family of Generalization Bounds Using Samplewise Evaluated CMI.,"Fredrik Hellström, Giuseppe Durisi","36th NeurIPS 2022: New Orleans, LA, USA",2022,http://papers.nips.cc/paper_files/paper/2022/hash/41b6674c28a9b93ec8d22a53ca25bc3b-Abstract-Conference.html
Maximum-Likelihood Inverse Reinforcement Learning with Finite-Time Guarantees.,"Siliang Zeng, Chenliang Li, Alfredo García, Mingyi Hong","36th NeurIPS 2022: New Orleans, LA, USA",2022,http://papers.nips.cc/paper_files/paper/2022/hash/41bd71e7bf7f9fe68f1c936940fd06bd-Abstract-Conference.html
Lost in Latent Space: Examining failures of disentangled models at combinatorial generalisation.,"Milton Llera Montero, Jeffrey S. Bowers, Rui Ponte Costa, Casimir J. H. Ludwig, Gaurav Malhotra","36th NeurIPS 2022: New Orleans, LA, USA",2022,http://papers.nips.cc/paper_files/paper/2022/hash/41ca8a0eb2bc4927a499b910934b9b81-Abstract-Conference.html
MultiGuard: Provably Robust Multi-label Classification against Adversarial Examples.,"Jinyuan Jia, Wenjie Qu, Neil Zhenqiang Gong","36th NeurIPS 2022: New Orleans, LA, USA",2022,http://papers.nips.cc/paper_files/paper/2022/hash/41fb2ecb5b7d1b505bca787de0a603dc-Abstract-Conference.html
On Measuring Excess Capacity in Neural Networks.,"Florian Graf, Sebastian Zeng, Bastian Rieck, Marc Niethammer, Roland Kwitt","36th NeurIPS 2022: New Orleans, LA, USA",2022,http://papers.nips.cc/paper_files/paper/2022/hash/420492060687ca7448398c4c3fa10366-Abstract-Conference.html
On Leave-One-Out Conditional Mutual Information For Generalization.,"Mohamad Rida Rammal, Alessandro Achille, Aditya Golatkar, Suhas N. Diggavi, Stefano Soatto","36th NeurIPS 2022: New Orleans, LA, USA",2022,http://papers.nips.cc/paper_files/paper/2022/hash/421fa4f5e0bef2f044f1f4616fd17343-Abstract-Conference.html
Near-Isometric Properties of Kronecker-Structured Random Tensor Embeddings.,Qijia Jiang,"36th NeurIPS 2022: New Orleans, LA, USA",2022,http://papers.nips.cc/paper_files/paper/2022/hash/423295ba2cea13cda44dc0a7d48ae244-Abstract-Conference.html
MExMI: Pool-based Active Model Extraction Crossover Membership Inference.,"Yaxin Xiao, Qingqing Ye, Haibo Hu, Huadi Zheng, Chengfang Fang, Jie Shi","36th NeurIPS 2022: New Orleans, LA, USA",2022,http://papers.nips.cc/paper_files/paper/2022/hash/4241c27d3161c7a7064bfc1a6e539563-Abstract-Conference.html
Parameter-Efficient Masking Networks.,"Yue Bai, Huan Wang, Xu Ma, Yitian Zhang, Zhiqiang Tao, Yun Fu","36th NeurIPS 2022: New Orleans, LA, USA",2022,http://papers.nips.cc/paper_files/paper/2022/hash/427048354ac2db22d43149c51346bafd-Abstract-Conference.html
How Sampling Impacts the Robustness of Stochastic Neural Networks.,"Sina Däubener, Asja Fischer","36th NeurIPS 2022: New Orleans, LA, USA",2022,http://papers.nips.cc/paper_files/paper/2022/hash/429d69979c22b06d6baa65caf3ab1e10-Abstract-Conference.html
Toward Robust Spiking Neural Network Against Adversarial Perturbation.,"Ling Liang, Kaidi Xu, Xing Hu, Lei Deng, Yuan Xie","36th NeurIPS 2022: New Orleans, LA, USA",2022,http://papers.nips.cc/paper_files/paper/2022/hash/42bc612558891859b1b8717051f2c7b0-Abstract-Conference.html
GRASP: Navigating Retrosynthetic Planning with Goal-driven Policy.,"Yemin Yu, Ying Wei, Kun Kuang, Zhengxing Huang, Huaxiu Yao, Fei Wu","36th NeurIPS 2022: New Orleans, LA, USA",2022,http://papers.nips.cc/paper_files/paper/2022/hash/42beaab8aa8da1c77581609a61eced93-Abstract-Conference.html
End-to-end Symbolic Regression with Transformers.,"Pierre-Alexandre Kamienny, Stéphane d'Ascoli, Guillaume Lample, François Charton","36th NeurIPS 2022: New Orleans, LA, USA",2022,http://papers.nips.cc/paper_files/paper/2022/hash/42eb37cdbefd7abae0835f4b67548c39-Abstract-Conference.html
Gold-standard solutions to the Schrödinger equation using deep learning: How much physics do we need?,"Leon Gerard, Michael Scherbela, Philipp Marquetand, Philipp Grohs","36th NeurIPS 2022: New Orleans, LA, USA",2022,http://papers.nips.cc/paper_files/paper/2022/hash/430894999584d0bd358611e2ecf00b15-Abstract-Conference.html
EcoFormer: Energy-Saving Attention with Linear Complexity.,"Jing Liu, Zizheng Pan, Haoyu He, Jianfei Cai, Bohan Zhuang","36th NeurIPS 2022: New Orleans, LA, USA",2022,http://papers.nips.cc/paper_files/paper/2022/hash/4310ae054ce265e56d8ea897971149b5-Abstract-Conference.html
Wild-Time: A Benchmark of in-the-Wild Distribution Shift over Time.,"Huaxiu Yao, Caroline Choi, Bochuan Cao, Yoonho Lee, Pang Wei Koh, Chelsea Finn","36th NeurIPS 2022: New Orleans, LA, USA",2022,http://papers.nips.cc/paper_files/paper/2022/hash/43119db5d59f07cc08fca7ba6820179a-Abstract-Datasets_and_Benchmarks.html
Sound and Complete Causal Identification with Latent Variables Given Local Background Knowledge.,"Tian-Zuo Wang, Tian Qin, Zhi-Hua Zhou","36th NeurIPS 2022: New Orleans, LA, USA",2022,http://papers.nips.cc/paper_files/paper/2022/hash/4334031bd9d518af18a6aba32ad70c8e-Abstract-Conference.html
A Unified Diversity Measure for Multiagent Reinforcement Learning.,"Zongkai Liu, Chao Yu, Yaodong Yang, Peng Sun, Zifan Wu, Yuan Li","36th NeurIPS 2022: New Orleans, LA, USA",2022,http://papers.nips.cc/paper_files/paper/2022/hash/435cce71b4007699041dfffa4f034079-Abstract-Conference.html
HorNet: Efficient High-Order Spatial Interactions with Recursive Gated Convolutions.,"Yongming Rao, Wenliang Zhao, Yansong Tang, Jie Zhou, Ser-Nam Lim, Jiwen Lu","36th NeurIPS 2022: New Orleans, LA, USA",2022,http://papers.nips.cc/paper_files/paper/2022/hash/436d042b2dd81214d23ae43eb196b146-Abstract-Conference.html
Learning Tractable Probabilistic Models from Inconsistent Local Estimates.,"Shasha Jin, Vasundhara Komaragiri, Tahrima Rahman, Vibhav Gogate","36th NeurIPS 2022: New Orleans, LA, USA",2022,http://papers.nips.cc/paper_files/paper/2022/hash/437d9bde2999f6e3e854e09f250261a5-Abstract-Conference.html
Decomposed Knowledge Distillation for Class-Incremental Semantic Segmentation.,"Donghyeon Baek, Youngmin Oh, Sanghoon Lee, Junghyup Lee, Bumsub Ham","36th NeurIPS 2022: New Orleans, LA, USA",2022,http://papers.nips.cc/paper_files/paper/2022/hash/439bf902de1807088d8b731ca20b0777-Abstract-Conference.html
Minimax Optimal Algorithms for Fixed-Budget Best Arm Identification.,"Junpei Komiyama, Taira Tsuchiya, Junya Honda","36th NeurIPS 2022: New Orleans, LA, USA",2022,http://papers.nips.cc/paper_files/paper/2022/hash/43c18853329c7504996b255252b6cb1f-Abstract-Conference.html
Reduced Representation of Deformation Fields for Effective Non-rigid Shape Matching.,"Ramana Sundararaman, Riccardo Marin, Emanuele Rodolà, Maks Ovsjanikov","36th NeurIPS 2022: New Orleans, LA, USA",2022,http://papers.nips.cc/paper_files/paper/2022/hash/43d1d3bdd92204c96fa4ac3c578f6a33-Abstract-Conference.html
BEVFusion: A Simple and Robust LiDAR-Camera Fusion Framework.,"Tingting Liang, Hongwei Xie, Kaicheng Yu, Zhongyu Xia, Zhiwei Lin, Yongtao Wang, Tao Tang, Bing Wang, Zhi Tang","36th NeurIPS 2022: New Orleans, LA, USA",2022,http://papers.nips.cc/paper_files/paper/2022/hash/43d2b7fbee8431f7cef0d0afed51c691-Abstract-Conference.html
Automatic Differentiation of Programs with Discrete Randomness.,"Gaurav Arya, Moritz Schauer, Frank Schäfer, Christopher Rackauckas","36th NeurIPS 2022: New Orleans, LA, USA",2022,http://papers.nips.cc/paper_files/paper/2022/hash/43d8e5fc816c692f342493331d5e98fc-Abstract-Conference.html
A Closer Look at the Adversarial Robustness of Deep Equilibrium Models.,"Zonghan Yang, Tianyu Pang, Yang Liu","36th NeurIPS 2022: New Orleans, LA, USA",2022,http://papers.nips.cc/paper_files/paper/2022/hash/43da8cca8f14139774bcbd935d51e0f2-Abstract-Conference.html
Near-Optimal Private and Scalable $k$-Clustering.,"Vincent Cohen-Addad, Alessandro Epasto, Vahab Mirrokni, Shyam Narayanan, Peilin Zhong","36th NeurIPS 2022: New Orleans, LA, USA",2022,http://papers.nips.cc/paper_files/paper/2022/hash/43f55776896a2e33239c2954519f605e-Abstract-Conference.html
NS3: Neuro-symbolic Semantic Code Search.,"Shushan Arakelyan, Anna Hakhverdyan, Miltiadis Allamanis, Luis Garcia, Christophe Hauser, Xiang Ren","36th NeurIPS 2022: New Orleans, LA, USA",2022,http://papers.nips.cc/paper_files/paper/2022/hash/43f5f6c5cb333115914c8448b8506411-Abstract-Conference.html
Revisiting Sparse Convolutional Model for Visual Recognition.,"Xili Dai, Mingyang Li, Pengyuan Zhai, Shengbang Tong, Xingjian Gao, Shao-Lun Huang, Zhihui Zhu, Chong You, Yi Ma","36th NeurIPS 2022: New Orleans, LA, USA",2022,http://papers.nips.cc/paper_files/paper/2022/hash/4418f6a54f4314202688d77956e731ce-Abstract-Conference.html
Temporal Latent Bottleneck: Synthesis of Fast and Slow Processing Mechanisms in Sequence Learning.,"Aniket Didolkar, Kshitij Gupta, Anirudh Goyal, Nitesh B. Gundavarapu, Alex Lamb, Nan Rosemary Ke, Yoshua Bengio","36th NeurIPS 2022: New Orleans, LA, USA",2022,http://papers.nips.cc/paper_files/paper/2022/hash/4446b84fdf15b17c091582e4b86f8a05-Abstract-Conference.html
A Near-Optimal Primal-Dual Method for Off-Policy Learning in CMDP.,"Fan Chen, Junyu Zhang, Zaiwen Wen","36th NeurIPS 2022: New Orleans, LA, USA",2022,http://papers.nips.cc/paper_files/paper/2022/hash/444d69470b24ded080183c907b711bbf-Abstract-Conference.html
DReS-FL: Dropout-Resilient Secure Federated Learning for Non-IID Clients via Secret Data Sharing.,"Jiawei Shao, Yuchang Sun, Songze Li, Jun Zhang","36th NeurIPS 2022: New Orleans, LA, USA",2022,http://papers.nips.cc/paper_files/paper/2022/hash/448fc91f669c15d10364ee01d512cc10-Abstract-Conference.html
BackdoorBench: A Comprehensive Benchmark of Backdoor Learning.,"Baoyuan Wu, Hongrui Chen, Mingda Zhang, Zihao Zhu, Shaokui Wei, Danni Yuan, Chao Shen","36th NeurIPS 2022: New Orleans, LA, USA",2022,http://papers.nips.cc/paper_files/paper/2022/hash/4491ea1c91aa2b22c373e5f1dfce234f-Abstract-Datasets_and_Benchmarks.html
REVIVE: Regional Visual Representation Matters in Knowledge-Based Visual Question Answering.,"Yuanze Lin, Yujia Xie, Dongdong Chen, Yichong Xu, Chenguang Zhu, Lu Yuan","36th NeurIPS 2022: New Orleans, LA, USA",2022,http://papers.nips.cc/paper_files/paper/2022/hash/44956951349095f74492a5471128a7e0-Abstract-Conference.html
FedAvg with Fine Tuning: Local Updates Lead to Representation Learning.,"Liam Collins, Hamed Hassani, Aryan Mokhtari, Sanjay Shakkottai","36th NeurIPS 2022: New Orleans, LA, USA",2022,http://papers.nips.cc/paper_files/paper/2022/hash/449590dfd5789cc7043f85f8bb7afa47-Abstract-Conference.html
Modeling Transitivity and Cyclicity in Directed Graphs via Binary Code Box Embeddings.,"Dongxu Zhang, Michael Boratko, Cameron Musco, Andrew McCallum","36th NeurIPS 2022: New Orleans, LA, USA",2022,http://papers.nips.cc/paper_files/paper/2022/hash/44a1f18afd6d5cc34d7e5c3d8a80f63b-Abstract-Conference.html
Generalization Bounds for Gradient Methods via Discrete and Continuous Prior.,"Xuanyuan Luo, Bei Luo, Jian Li","36th NeurIPS 2022: New Orleans, LA, USA",2022,http://papers.nips.cc/paper_files/paper/2022/hash/44cdeb5ab7da31d9b5cd88fd44e3da84-Abstract-Conference.html
On Deep Generative Models for Approximation and Estimation of Distributions on Manifolds.,"Biraj Dahal, Alexander Havrilla, Minshuo Chen, Tuo Zhao, Wenjing Liao","36th NeurIPS 2022: New Orleans, LA, USA",2022,http://papers.nips.cc/paper_files/paper/2022/hash/44d20d542f3f4e3b7097e5e3f78f99f1-Abstract-Conference.html
Memory Efficient Continual Learning with Transformers.,"Beyza Ermis, Giovanni Zappella, Martin Wistuba, Aditya Rawal, Cédric Archambeau","36th NeurIPS 2022: New Orleans, LA, USA",2022,http://papers.nips.cc/paper_files/paper/2022/hash/4522de4178bddb36b49aa26efad537cf-Abstract-Conference.html
Counterfactual Neural Temporal Point Process for Estimating Causal Influence of Misinformation on Social Media.,"Yizhou Zhang, Defu Cao, Yan Liu","36th NeurIPS 2022: New Orleans, LA, USA",2022,http://papers.nips.cc/paper_files/paper/2022/hash/45542d647974ca6af58441c4817c9b5b-Abstract-Conference.html
Curriculum Reinforcement Learning using Optimal Transport via Gradual Domain Adaptation.,"Peide Huang, Mengdi Xu, Jiacheng Zhu, Laixi Shi, Fei Fang, Ding Zhao","36th NeurIPS 2022: New Orleans, LA, USA",2022,http://papers.nips.cc/paper_files/paper/2022/hash/4556f5398bd2c61bd7500e306b4e560a-Abstract-Conference.html
Temporally-Consistent Survival Analysis.,"Lucas Maystre, Daniel Russo","36th NeurIPS 2022: New Orleans, LA, USA",2022,http://papers.nips.cc/paper_files/paper/2022/hash/455e1e30edf721bd7fa334fffabdcad8-Abstract-Conference.html
Symbolic Distillation for Learned TCP Congestion Control.,"S. P. Sharan, Wenqing Zheng, Kuo-Feng Hsu, Jiarong Xing, Ang Chen, Zhangyang Wang","36th NeurIPS 2022: New Orleans, LA, USA",2022,http://papers.nips.cc/paper_files/paper/2022/hash/4574ac9854d4defe3bf119d07b817084-Abstract-Conference.html
A Probabilistic Graph Coupling View of Dimension Reduction.,"Hugues Van Assel, Thibault Espinasse, Julien Chiquet, Franck Picard","36th NeurIPS 2022: New Orleans, LA, USA",2022,http://papers.nips.cc/paper_files/paper/2022/hash/45994782a61bb51cad5c2bae36834265-Abstract-Conference.html
Hardness of Noise-Free Learning for Two-Hidden-Layer Neural Networks.,"Sitan Chen, Aravind Gollakota, Adam R. Klivans, Raghu Meka","36th NeurIPS 2022: New Orleans, LA, USA",2022,http://papers.nips.cc/paper_files/paper/2022/hash/45a7ca247462d9e465ee88c8a302ca70-Abstract-Conference.html
Convergence beyond the over-parameterized regime using Rayleigh quotients.,"David A. R. Robin, Kevin Scaman, Marc Lelarge","36th NeurIPS 2022: New Orleans, LA, USA",2022,http://papers.nips.cc/paper_files/paper/2022/hash/45d74e190008c7bff2845ffc8e3facd3-Abstract-Conference.html
Optimistic Posterior Sampling for Reinforcement Learning with Few Samples and Tight Guarantees.,"Daniil Tiapkin, Denis Belomestny, Daniele Calandriello, Eric Moulines, Rémi Munos, Alexey Naumov, Mark Rowland, Michal Valko, Pierre Ménard","36th NeurIPS 2022: New Orleans, LA, USA",2022,http://papers.nips.cc/paper_files/paper/2022/hash/45e15bae91a6f213d45e203b8a29be48-Abstract-Conference.html
"On Convergence of FedProx: Local Dissimilarity Invariant Bounds, Non-smoothness and Beyond.","Xiaotong Yuan, Ping Li","36th NeurIPS 2022: New Orleans, LA, USA",2022,http://papers.nips.cc/paper_files/paper/2022/hash/45ecdd6cf1f507d378a3442ed89e580b-Abstract-Conference.html
Can Push-forward Generative Models Fit Multimodal Distributions?,"Antoine Salmona, Valentin De Bortoli, Julie Delon, Agnès Desolneux","36th NeurIPS 2022: New Orleans, LA, USA",2022,http://papers.nips.cc/paper_files/paper/2022/hash/45f0d179ef7e10eb7366550cd4e574ae-Abstract-Conference.html
Improved Imaging by Invex Regularizers with Global Optima Guarantees.,"Samuel Pinilla, Tingting Mu, Neil Bourne, Jeyan Thiyagalingam","36th NeurIPS 2022: New Orleans, LA, USA",2022,http://papers.nips.cc/paper_files/paper/2022/hash/45f7927942098d14e473fc5d000031e2-Abstract-Conference.html
The Neural Covariance SDE: Shaped Infinite Depth-and-Width Networks at Initialization.,"Mufan (Bill) Li, Mihai Nica, Daniel M. Roy","36th NeurIPS 2022: New Orleans, LA, USA",2022,http://papers.nips.cc/paper_files/paper/2022/hash/45fc4a0da7e7f6fbabaabe2d20a441d1-Abstract-Conference.html
